<?xml version="1.0" encoding="UTF-8"?>
 
<!DOCTYPE package SYSTEM "promises.dtd">

<package name="java.awt">
    <class name="Graphics2D">

    <promise keyword="colorImport" contents="java.awt.*;"/>

  <promise keyword="promise"
    contents="&quot;colorConstraint GUI;&quot; for get*(**)"/>

  <promise keyword="promise"
    contents="&quot;colorConstraint GUI;&quot; for set*(**)"/>

  <promise keyword="promise"
    contents="&quot;colorConstraint GUI;&quot; for draw*(**)"/>

  <promise keyword="promise"
    contents="&quot;colorConstraint GUI;&quot; for fill*(**)"/>

  <promise keyword="promise"
    contents="&quot;colorConstraint GUI;&quot; for translate(**)"/>

    </class>
</package>
